{
  "schema_version": "1.0",
  "content_id": "insight-missing-source-note",
  "synthetic": true,
  "content": {
    "brand": "atomity",
    "title": "A new sovereign region changes where regulated workloads can run",
    "body": "Fictional Provider A opened a sovereign cloud region in Frankfurt on 3 October 2026, with 42 managed services at launch and operations run under EU jurisdiction.\n\nTeams holding data under residency rules can now weigh this region against their current hosting at the next placement review."
  },
  "approval": {
    "status": "approved",
    "approved_by": "review-workflow (synthetic fixture)",
    "approved_at": "2026-10-06T09:30:00Z",
    "content_sha256": "13f63a810a525410a2b1d75510ac6389e8e109353ef38916cfd87bb0c48652c7"
  }
}
