{
  "schema_version": "1.0",
  "content_id": "insight-long-title",
  "synthetic": true,
  "content": {
    "brand": "atomity",
    "title": "Fictional Provider A opens a sovereign cloud region in Frankfurt with 42 managed services, EU-resident operations staff and a residency commitment that changes where regulated workloads can run",
    "body": "Fictional Provider A opened a sovereign cloud region in Frankfurt on 3 October 2026, with 42 managed services at launch.",
    "source_note": "Fictional Provider A press release, 3 Oct 2026. Synthetic test content, not real news."
  },
  "approval": {
    "status": "approved",
    "approved_by": "review-workflow (synthetic fixture)",
    "approved_at": "2026-10-06T09:30:00Z",
    "content_sha256": "c4317c09eeb174c24209bc05d398c480d47f64c2d1ae91025e867dfe7626cf4f"
  }
}
